Categoría,Nombre,Cantidad,Suma de Precio Inicio(€),Suma de Precio Oferta(€),Cantidad del precio,Supermercado,Fecha
Melon_y_sandia,1/4 Sandía baja en semillas,"1/4 Pieza 1,53 kg aprox.",3.5,,ud.,Mercadona,2024-03-11 00:00:00
Verduras_al_vapor,3 Vegetales para microondas,Paquete 300 g,1.64,,ud.,Mercadona,2024-03-11 00:00:00
Aceite_de_girasol_semillas_y_maiz,Aceite de coco virgen Hacendado,Bote 450 ml,4.4,,ud.,Mercadona,2024-03-11 00:00:00
Aceite_de_girasol_semillas_y_maiz,"Aceite de girasol refinado 0,2º Hacendado",Botella 1 L,1.45,,ud.,Mercadona,2024-03-11 00:00:00
Aceite_de_girasol_semillas_y_maiz,"Aceite de girasol refinado 0,2º Hacendado",Garrafa 5 L,6.95,6.75,ud.,Mercadona,2024-03-11 00:00:00
Aceite_de_oliva,"Aceite de oliva 0,4º Hacendado",Botella 1 L,9.25,,ud.,Mercadona,2024-03-11 00:00:00
Aceite_de_oliva,Aceite de oliva 1º Hacendado,Botella 1 L,9.25,,ud.,Mercadona,2024-03-11 00:00:00
Aceite_de_oliva,Aceite de oliva intenso Hacendado,Garrafa 3 L,27.6,,ud.,Mercadona,2024-03-11 00:00:00
Aceite_de_oliva,Aceite de oliva suave Hacendado,Garrafa 3 L,27.6,,ud.,Mercadona,2024-03-11 00:00:00
Aceite_de_oliva,Aceite de oliva virgen extra Hacendado,Botella 1 L,9.9,,ud.,Mercadona,2024-03-11 00:00:00
Aceite_de_oliva,Aceite de oliva virgen extra Hacendado,Garrafa 3 L,29.55,,ud.,Mercadona,2024-03-11 00:00:00
Aceite_de_oliva,Aceite de oliva virgen extra Hacendado,Spray 200 ml,3.3,,ud.,Mercadona,2024-03-11 00:00:00
Aceite_de_oliva,Aceite de oliva virgen extra Hacendado Gran Selección,Botella 750 ml,8.1,,ud.,Mercadona,2024-03-11 00:00:00
Aceite_de_oliva,Aceite de oliva virgen extra Picual Casa Juncal,Botella 500 ml,7.85,,ud.,Mercadona,2024-03-11 00:00:00
Aceite_de_oliva,Aceite de oliva virgen Hacendado,Botella 1 L,9.55,,ud.,Mercadona,2024-03-11 00:00:00
Aceite_de_oliva,Aceite de oliva virgen Hacendado,Garrafa 3 L,28.5,,ud.,Mercadona,2024-03-11 00:00:00
Vinagre_y_otros_aderezos,"Aceite de oliva, vinagre y sal Merry",15 monodosis x 10 ml,2.2,,pack,Mercadona,2024-03-11 00:00:00
Otras_verduras_y_hortalizas,Acelgas,Paquete 800 g,2.26,,ud.,Mercadona,2024-03-11 00:00:00
Otras_verduras_y_hortalizas,Acelgas cortadas,Paquete 300 g,1.2,,ud.,Mercadona,2024-03-11 00:00:00
Agua_sin_gas,Agua de coco Chaokoh 100% natural,Brick 1 L,2.6,,ud.,Mercadona,2024-03-11 00:00:00
Agua_con_gas,Agua de soda con sifón La Casa,"Botella 1,5 L",1.6,,ud.,Mercadona,2024-03-11 00:00:00
Agua_con_gas,Agua mineral con gas grande Aguadoy,"6 botellas x 1,5 L",2.46,,pack,Mercadona,2024-03-11 00:00:00
Agua_con_gas,Agua mineral con gas grande Aguadoy,"Botella 1,5 L",0.41,,ud.,Mercadona,2024-03-11 00:00:00
Agua_con_gas,Agua mineral con gas grande Vichy Catalan,Botella 1 L,1.49,,ud.,Mercadona,2024-03-11 00:00:00
Agua_con_gas,Agua mineral con gas pequeña Aguadoy,6 botellas x 500 ml,1.62,,pack,Mercadona,2024-03-11 00:00:00
Agua_con_gas,Agua mineral con gas pequeña Aguadoy,Botella 500 ml,0.27,,ud.,Mercadona,2024-03-11 00:00:00
Agua_con_gas,Agua mineral con gas pequeña Vichy Catalan,6 botellas x 300 ml,5.89,,pack,Mercadona,2024-03-11 00:00:00
Agua_sin_gas,Agua mineral grande Aguadoy,"6 botellas x 1,5 L",1.5,,pack,Mercadona,2024-03-11 00:00:00
Agua_sin_gas,Agua mineral grande Aguadoy,"Botella 1,5 L",0.25,,ud.,Mercadona,2024-03-11 00:00:00
Agua_sin_gas,Agua mineral grande Aguadoy,Garrafa 6 L,0.78,,ud.,Mercadona,2024-03-11 00:00:00
Agua_sin_gas,Agua mineral grande Aguadoy,Garrafa 8 L,0.89,,ud.,Mercadona,2024-03-11 00:00:00
Agua_sin_gas,Agua mineral grande Fuente Dehesa,"6 botellas x 1,5 L",2.34,,pack,Mercadona,2024-03-11 00:00:00
Agua_sin_gas,Agua mineral grande Fuente Dehesa,"Botella 1,5 L",0.39,,ud.,Mercadona,2024-03-11 00:00:00
Agua_sin_gas,Agua mineral grande Fuente Dehesa,Garrafa 6 L,1.26,,ud.,Mercadona,2024-03-11 00:00:00
Agua_sin_gas,Agua mineral grande Lanjarón,"6 botellas x 1,5 L",4.2,,pack,Mercadona,2024-03-11 00:00:00
Agua_sin_gas,Agua mineral grande Lanjarón,"Botella 1,5 L",0.73,,ud.,Mercadona,2024-03-11 00:00:00
Agua_sin_gas,Agua mineral grande Liviana,6 botellas x 2 L,4.8,,pack,Mercadona,2024-03-11 00:00:00
Agua_sin_gas,Agua mineral grande Liviana,Botella 2 L,0.8,,ud.,Mercadona,2024-03-11 00:00:00
Agua_sin_gas,Agua mineral grande Nestlé Aquarel,"6 botellas x 1,5 L",3.54,,pack,Mercadona,2024-03-11 00:00:00
Agua_sin_gas,Agua mineral grande Nestlé Aquarel,"Botella 1,5 L",0.59,,ud.,Mercadona,2024-03-11 00:00:00
Agua_sin_gas,Agua mineral grande Solán de Cabras,"6 botellas x 1,5 L",5.34,,pack,Mercadona,2024-03-11 00:00:00
Agua_sin_gas,Agua mineral grande Solán de Cabras,"Botella 1,5 L",0.89,,ud.,Mercadona,2024-03-11 00:00:00
Agua_sin_gas,Agua mineral mediana Aguadoy,6 botellas x 1 L,2.4,,pack,Mercadona,2024-03-11 00:00:00
Agua_sin_gas,Agua mineral mediana Aguadoy,Botella 1 L,0.4,,ud.,Mercadona,2024-03-11 00:00:00
Agua_sin_gas,Agua mineral mediana Fuente Dehesa,6 botellas x 1 L,3,,pack,Mercadona,2024-03-11 00:00:00
Agua_sin_gas,Agua mineral mediana Fuente Dehesa,Botella 1 L,0.5,,ud.,Mercadona,2024-03-11 00:00:00
Agua_sin_gas,Agua mineral pequeña Aguadoy,6 botellas x 500 ml,1.32,,pack,Mercadona,2024-03-11 00:00:00
Agua_sin_gas,Agua mineral pequeña Aguadoy,Botella 500 ml,0.22,,ud.,Mercadona,2024-03-11 00:00:00
Agua_sin_gas,Agua mineral pequeña Aguadoy tapón infantil,6 botellas x 330 ml,1.44,,pack,Mercadona,2024-03-11 00:00:00
Agua_sin_gas,Agua mineral pequeña Aguadoy tapón infantil,Botella 330 ml,0.24,,ud.,Mercadona,2024-03-11 00:00:00
Agua_sin_gas,Agua mineral pequeña Fuente Dehesa,6 botellas x 500 ml,1.62,,pack,Mercadona,2024-03-11 00:00:00
Agua_sin_gas,Agua mineral pequeña Fuente Dehesa,Botella 500 ml,0.27,,ud.,Mercadona,2024-03-11 00:00:00
Agua_sin_gas,Agua mineral pequeña Fuente Dehesa tapón infantil,6 botellas x 330 ml,2.28,,pack,Mercadona,2024-03-11 00:00:00
Agua_sin_gas,Agua mineral pequeña Fuente Dehesa tapón infantil,Botella 330 ml,0.38,,ud.,Mercadona,2024-03-11 00:00:00
Fruta_tropical,Aguacate,Pieza 254 g aprox.,1.33,,ud.,Mercadona,2024-03-11 00:00:00
Fruta_tropical,Aguacates,550 g aprox.,2.69,,pack,Mercadona,2024-03-11 00:00:00
Cebolla_y_ajo,Ajo negro dientes pelados,Tarrina 85 g,4.45,,ud.,Mercadona,2024-03-11 00:00:00
Cebolla_y_ajo,Ajo tierno,Manojo 200 g,2.35,,ud.,Mercadona,2024-03-11 00:00:00
Cebolla_y_ajo,Ajos morados,Malla 250 g,1.55,,ud.,Mercadona,2024-03-11 00:00:00
Cebolla_y_ajo,Ajos morados,Malla 400 g,2.1,,ud.,Mercadona,2024-03-11 00:00:00
Hierbas_aromaticas,Albahaca,Bandeja 20 g,1.5,,ud.,Mercadona,2024-03-11 00:00:00
Otras_verduras_y_hortalizas,Alcachofa,Pieza 150 g aprox.,0.4,,ud.,Mercadona,2024-03-11 00:00:00
Alubias,Alubia blanca Hacendado,Paquete 1 kg,1.85,,ud.,Mercadona,2024-03-11 00:00:00
Alubias,Alubia cocida blanca Hacendado,Tarro 295 g (210 g escurrido),0.65,,ud.,Mercadona,2024-03-11 00:00:00
Alubias,Alubia cocida blanca Hacendado,Tarro 570 g (400 g escurrido),0.69,,ud.,Mercadona,2024-03-11 00:00:00
Alubias,Alubia cocida granja Hacendado,Tarro 570 g (350 g escurrido),1.5,,ud.,Mercadona,2024-03-11 00:00:00
Alubias,Alubia cocida pinta Hacendado,Tarro 570 g (400 g escurrido),1.1,,ud.,Mercadona,2024-03-11 00:00:00
Alubias,Alubia cocida roja Hacendado,Tarro 570 g (400 g escurrido),1.05,,ud.,Mercadona,2024-03-11 00:00:00
Alubias,Alubia granja Hacendado,Paquete 500 g,2.84,,ud.,Mercadona,2024-03-11 00:00:00
Alubias,Alubia negra Hacendado,Paquete 1 kg,2.4,,ud.,Mercadona,2024-03-11 00:00:00
Alubias,Alubia pinta Hacendado,Paquete 1 kg,2.16,,ud.,Mercadona,2024-03-11 00:00:00
Alubias,Alubia roja Hacendado,Paquete 1 kg,2.55,,ud.,Mercadona,2024-03-11 00:00:00
Otras_verduras_y_hortalizas,Apio verde,Paquete 660 g aprox.,1.26,,ud.,Mercadona,2024-03-11 00:00:00
Otras_frutas,Arándanos,Tarrina 500 g,6.49,6.25,ud.,Mercadona,2024-03-11 00:00:00
Otras_frutas,Arándanos,Vaso 225 g,3.15,2.99,ud.,Mercadona,2024-03-11 00:00:00
Arroz,Arroz basmati aromático Hacendado,Paquete 1 kg,2.54,2.44,ud.,Mercadona,2024-03-11 00:00:00
Arroz,Arroz bomba Hacendado,Paquete 1 kg,4.9,,ud.,Mercadona,2024-03-11 00:00:00
Arroz,Arroz cocido basmati Sabroz,2 vasitos x 125 g,1.2,,pack,Mercadona,2024-03-11 00:00:00
Arroz,Arroz cocido integral Sabroz,2 vasitos x 125 g,1.15,,pack,Mercadona,2024-03-11 00:00:00
Arroz,Arroz cocido redondo Sabroz,2 vasitos x 125 g,1.15,,pack,Mercadona,2024-03-11 00:00:00
Arroz,Arroz integral redondo Hacendado,Paquete 1 kg,1.7,,ud.,Mercadona,2024-03-11 00:00:00
Arroz,Arroz largo Hacendado,Paquete 1 kg,1.3,,ud.,Mercadona,2024-03-11 00:00:00
Arroz,Arroz redondo Hacendado,Paquete 1 kg,1.27,,ud.,Mercadona,2024-03-11 00:00:00
Arroz,Arroz redondo J Sendra Hacendado,Paquete 1 kg,1.54,,ud.,Mercadona,2024-03-11 00:00:00
Arroz,Arroz redondo Sabroz,Paquete 1 kg,2.68,,ud.,Mercadona,2024-03-11 00:00:00
Arroz,Arroz redondo SOS,Paquete 1 kg,1.8,,ud.,Mercadona,2024-03-11 00:00:00
Arroz,Arroz vaporizado Hacendado,Paquete 1 kg,1.54,,ud.,Mercadona,2024-03-11 00:00:00
Cereales_integrales_y_muesli,Avena molida Hacendado,Paquete 500 g,1.11,,ud.,Mercadona,2024-03-11 00:00:00
Azucar,Azúcar blanco en sobres Hacendado,Caja 50 sticks (350 g),1.55,,ud.,Mercadona,2024-03-11 00:00:00
Azucar,Azúcar blanco Hacendado,Paquete 1 kg,1.45,,ud.,Mercadona,2024-03-11 00:00:00
Azucar,Azúcar glas Hacendado,Bote 500 g,2.6,,ud.,Mercadona,2024-03-11 00:00:00
Azucar,Azúcar moreno de caña en sobres Hacendado,Caja 50 sobres (350 g),1.6,,ud.,Mercadona,2024-03-11 00:00:00
Azucar,Azúcar moreno de caña Hacendado,Paquete 1 kg,1.95,,ud.,Mercadona,2024-03-11 00:00:00
Platano_y_uva,Banana,Pieza 184 g aprox.,0.27,,ud.,Mercadona,2024-03-11 00:00:00
Galletas_con_chocolate_y_rellenas,Barquillos con crema de avellanas Hacendado,Paquete 250 g,1.5,,ud.,Mercadona,2024-03-11 00:00:00
Galletas_con_chocolate_y_rellenas,Barquillos rellenos de chocolate Hacendado,Paquete 210 g,1,,ud.,Mercadona,2024-03-11 00:00:00
Galletas_con_chocolate_y_rellenas,Barquillos rellenos de nata Hacendado 0% azúcares añadidos,Paquete 210 g,1.1,,ud.,Mercadona,2024-03-11 00:00:00
Galletas_con_chocolate_y_rellenas,Barquillos rellenos sabor nata Hacendado,Paquete 210 g,1,,ud.,Mercadona,2024-03-11 00:00:00
Barritas_de_cereales,Barrita con proteínas Enervit Sport sabor chocolate negro,Caja 3 barritas (180 g),4.9,,ud.,Mercadona,2024-03-11 00:00:00
Barritas_de_cereales,Barritas 100% fruta de manzana y plátano Hacendado,Caja 3 barritas (90 g),1.75,,ud.,Mercadona,2024-03-11 00:00:00
Barritas_de_cereales,Barritas con proteínas Enervit Sport sabor coco y chocolate,Caja 3 barritas (120 g),3.15,2.75,ud.,Mercadona,2024-03-11 00:00:00
Barritas_de_cereales,Barritas de avena Hacendado con chocolate negro,Caja 6 paquetes (252 g),2.35,,ud.,Mercadona,2024-03-11 00:00:00
Barritas_de_cereales,Barritas de cereales con frutos secos Hacendado,Caja 6 barritas (150 g),1.65,,ud.,Mercadona,2024-03-11 00:00:00
Barritas_de_cereales,Barritas de cereales Hacendado chocolate con leche,Caja 6 barritas (120 g),1.4,,ud.,Mercadona,2024-03-11 00:00:00
Barritas_de_cereales,Barritas de cereales Hacendado con cacahuetes sabor caramelo,Caja 4 barritas (138 g),1.7,,ud.,Mercadona,2024-03-11 00:00:00
Barritas_de_cereales,Barritas de cereales Hacendado con chocolate blanco,Caja 6 barritas (127 g),1.3,,ud.,Mercadona,2024-03-11 00:00:00
Barritas_de_cereales,Barritas de cereales muesli Hacendado con chocolate,Caja 6 barritas (138 g),1.4,,ud.,Mercadona,2024-03-11 00:00:00
Barritas_de_cereales,Barritas de espelta Hacendado sabor manzana,Caja 6 barritas (120 g),1.5,,ud.,Mercadona,2024-03-11 00:00:00
Galletas_con_chocolate_y_rellenas,Barritas de galleta bañadas en chocolate con leche Chips Ahoy,Caja 5 barritas (140 g),1.25,,ud.,Mercadona,2024-03-11 00:00:00
Barritas_de_cereales,Barritas de galleta rellenas de arándanos Hacendado,Caja 5 barritas (125 g),1.5,,ud.,Mercadona,2024-03-11 00:00:00
Barritas_de_cereales,Barritas Sustitutivo de comida Belladieta sabor avena y chocolate con leche,Caja 4 barritas (120 g),3.1,,ud.,Mercadona,2024-03-11 00:00:00
Patata,Batata,Pieza 424 g aprox.,0.89,,ud.,Mercadona,2024-03-11 00:00:00
Verduras_al_vapor,Batata para microondas,Paquete 400 g,2.4,,ud.,Mercadona,2024-03-11 00:00:00
Batidos,Batido de chocolate 90% leche Hacendado,6 mini bricks x 200 ml,1.65,,pack,Mercadona,2024-03-11 00:00:00
Batidos,Batido de chocolate 90% leche Hacendado,Botella 1 L,1.35,,ud.,Mercadona,2024-03-11 00:00:00
Batidos,Batido de chocolate 90% leche Puleva,6 mini bricks x 200 ml,2.75,,pack,Mercadona,2024-03-11 00:00:00
Batidos,Batido de chocolate ColaCao Energy,4 mini botellas x 188 ml,2.65,,pack,Mercadona,2024-03-11 00:00:00
Batidos,Batido de chocolate Hacendado,6 mini bricks x 200 ml,1.4,,pack,Mercadona,2024-03-11 00:00:00
Batidos,Batido de chocolate Hacendado,Botella 1 L,1.2,,ud.,Mercadona,2024-03-11 00:00:00
Batidos,Batido de chocolate Hacendado 0% sin azúcares añadidos,6 mini bricks x 200 ml,1.85,,pack,Mercadona,2024-03-11 00:00:00
Batidos,Batido de vainilla Hacendado,6 mini bricks x 200 ml,1.55,,pack,Mercadona,2024-03-11 00:00:00
Batidos,Batido sabor fresa Hacendado,6 mini bricks x 200 ml,1.55,,pack,Mercadona,2024-03-11 00:00:00
Batidos,Batido sabor fresa Hacendado,Botella 1 L,1.2,,ud.,Mercadona,2024-03-11 00:00:00
Batidos,Batido sabor vainilla Hacendado,Botella 1 L,1.2,,ud.,Mercadona,2024-03-11 00:00:00
Vinagre_y_otros_aderezos,Bebida aromatizada a base de vino para cocinar Abuela Carola,Botella 750 ml,2.35,,ud.,Mercadona,2024-03-11 00:00:00
Bebidas_vegetales,Bebida de almendras Hacendado,6 bricks x 1 L,7.8,7.5,pack,Mercadona,2024-03-11 00:00:00
Bebidas_vegetales,Bebida de almendras Hacendado,Brick 1 L,1.3,1.25,ud.,Mercadona,2024-03-11 00:00:00
Bebidas_vegetales,Bebida de almendras zero Hacendado,6 bricks x 1 L,8.1,7.8,pack,Mercadona,2024-03-11 00:00:00
Bebidas_vegetales,Bebida de almendras zero Hacendado,Brick 1 L,1.35,1.3,ud.,Mercadona,2024-03-11 00:00:00
Bebidas_vegetales,Bebida de arroz sin azúcares añadidos Hacendado,6 bricks x 1 L,6.6,,pack,Mercadona,2024-03-11 00:00:00
Bebidas_vegetales,Bebida de arroz sin azúcares añadidos Hacendado,Brick 1 L,1.1,,ud.,Mercadona,2024-03-11 00:00:00
Bebidas_vegetales,Bebida de avellana y arroz sin azúcares añadidos Hacendado,6 bricks x 1 L,8.1,7.8,pack,Mercadona,2024-03-11 00:00:00
Bebidas_vegetales,Bebida de avellana y arroz sin azúcares añadidos Hacendado,Brick 1 L,1.35,1.3,ud.,Mercadona,2024-03-11 00:00:00
Bebidas_vegetales,Bebida de avena Alitey,3 mini bricks x 250 ml,1.5,,pack,Mercadona,2024-03-11 00:00:00
Bebidas_vegetales,Bebida de avena Alitey,6 bricks x 1 L,5.7,,pack,Mercadona,2024-03-11 00:00:00
Bebidas_vegetales,Bebida de avena Alitey,Brick 1 L,0.95,,ud.,Mercadona,2024-03-11 00:00:00
Bebidas_vegetales,Bebida de avena con café Hacendado,Vaso 250 ml,0.9,,ud.,Mercadona,2024-03-11 00:00:00
Bebidas_vegetales,Bebida de avena con chocolate Hacendado sin azucares añadidos,6 bricks x 1 L,7.2,,pack,Mercadona,2024-03-11 00:00:00
Bebidas_vegetales,Bebida de avena con chocolate sin azúcares añadidos Hacendado,3 mini bricks x 250 ml,1.55,,pack,Mercadona,2024-03-11 00:00:00
Bebidas_vegetales,Bebida de avena con chocolate sin azúcares añadidos Hacendado,Brick 1 L,1.2,,ud.,Mercadona,2024-03-11 00:00:00
Bebidas_vegetales,Bebida de avena Hacendado 0% azúcar,6 bricks x 1 L,4.8,,pack,Mercadona,2024-03-11 00:00:00
Bebidas_vegetales,Bebida de avena Hacendado 0% azúcar,Brick 1 L,0.8,,ud.,Mercadona,2024-03-11 00:00:00
Bebidas_vegetales,Bebida de avena sin azúcares añadidos Hacendado,6 bricks x 1 L,7.2,,pack,Mercadona,2024-03-11 00:00:00
Bebidas_vegetales,Bebida de avena sin azúcares añadidos Hacendado,Brick 1 L,1.2,,ud.,Mercadona,2024-03-11 00:00:00
Bebidas_vegetales,Bebida de chufa Hacendado sin azúcares añadidos,Brick 1 L,1.5,,ud.,Mercadona,2024-03-11 00:00:00
Bebidas_vegetales,Bebida de coco y arroz sin azúcares añadidos Hacendado,6 bricks x 1 L,9,,pack,Mercadona,2024-03-11 00:00:00
Bebidas_vegetales,Bebida de coco y arroz sin azúcares añadidos Hacendado,Brick 1 L,1.5,,ud.,Mercadona,2024-03-11 00:00:00
Bebidas_vegetales,Bebida de soja 0% azúcares Hacendado,6 bricks x 1 L,4.8,,pack,Mercadona,2024-03-11 00:00:00
Bebidas_vegetales,Bebida de soja 0% azúcares Hacendado,Brick 1 L,0.8,,ud.,Mercadona,2024-03-11 00:00:00
Bebidas_vegetales,Bebida de soja con calcio y vitaminas Hacendado,6 bricks x 1 L,4.2,,pack,Mercadona,2024-03-11 00:00:00
Bebidas_vegetales,Bebida de soja con calcio y vitaminas Hacendado,Brick 1 L,0.7,,ud.,Mercadona,2024-03-11 00:00:00
Bebidas_vegetales,Bebida de soja sabor café sin azúcares añadidos Hacendado,6 bricks x 1 L,7.5,,pack,Mercadona,2024-03-11 00:00:00
Bebidas_vegetales,Bebida de soja sabor café sin azúcares añadidos Hacendado,Brick 1 L,1.25,,ud.,Mercadona,2024-03-11 00:00:00
Bebidas_vegetales,Bebida de soja sabor vainilla Hacendado 0% azúcar,6 bricks x 1 L,6.6,,pack,Mercadona,2024-03-11 00:00:00
Bebidas_vegetales,Bebida de soja sabor vainilla Hacendado 0% azúcar,Brick 1 L,1.1,,ud.,Mercadona,2024-03-11 00:00:00
Leche_infantil,Bebida láctea con cereales crecimiento y desarrollo Puleva Max,6 bricks x 1 L,11.34,,pack,Mercadona,2024-03-11 00:00:00
Leche_infantil,Bebida láctea con cereales crecimiento y desarrollo Puleva Max,Brick 1 L,1.89,,ud.,Mercadona,2024-03-11 00:00:00
Leche_infantil,Bebida láctea crecimiento y desarrollo Puleva Max,6 bricks x 1 L,11.34,,pack,Mercadona,2024-03-11 00:00:00
Leche_infantil,Bebida láctea crecimiento y desarrollo Puleva Max,Brick 1 L,1.89,,ud.,Mercadona,2024-03-11 00:00:00
Leche_desnatada,Bebida láctea desnatada omega 3 Hacendado,6 bricks x 1 L,6.6,,pack,Mercadona,2024-03-11 00:00:00
Leche_desnatada,Bebida láctea desnatada omega 3 Hacendado,Brick 1 L,1.1,,ud.,Mercadona,2024-03-11 00:00:00
Leche_desnatada,Bebida láctea Omega 3 Puleva con leche desnatada,6 bricks x 1 L,11.4,,pack,Mercadona,2024-03-11 00:00:00
Leche_desnatada,Bebida láctea Omega 3 Puleva con leche desnatada,Brick 1 L,1.9,,ud.,Mercadona,2024-03-11 00:00:00
Leche_desnatada,Bebida láctea Omega 3 Puleva con nueces y leche desnatada,6 bricks x 1 L,11.7,,pack,Mercadona,2024-03-11 00:00:00
Leche_desnatada,Bebida láctea Omega 3 Puleva con nueces y leche desnatada,Brick 1 L,1.95,,ud.,Mercadona,2024-03-11 00:00:00
Leche_semidesnatada,Bebida láctea semidesnatada con fibra Hacendado,6 bricks x 1 L,7.5,,pack,Mercadona,2024-03-11 00:00:00
Leche_semidesnatada,Bebida láctea semidesnatada con fibra Hacendado,Brick 1 L,1.25,,ud.,Mercadona,2024-03-11 00:00:00
Otras_verduras_y_hortalizas,Berenjena,Pieza 366 g aprox.,0.58,,ud.,Mercadona,2024-03-11 00:00:00
Sal_y_bicarbonato,Bicarbonato sódico Hacendado,Bote 300 g,1.1,,ud.,Mercadona,2024-03-11 00:00:00
Sal_y_bicarbonato,Bicarbonato sódico Hacendado,Paquete 1 kg,1.5,,ud.,Mercadona,2024-03-11 00:00:00
Otras_verduras_y_hortalizas,Brócoli,Pieza 393 g aprox.,0.98,,ud.,Mercadona,2024-03-11 00:00:00
Calabacin_y_pimiento,Calabacín blanco,Pieza 352 g aprox.,0.7,,ud.,Mercadona,2024-03-11 00:00:00
Calabacin_y_pimiento,Calabacín verde,Pieza 403 g aprox.,0.72,,ud.,Mercadona,2024-03-11 00:00:00
Otras_verduras_y_hortalizas,Calabaza cacahuete,"Pieza 1,06 kg aprox.",1.96,,ud.,Mercadona,2024-03-11 00:00:00
Otras_verduras_y_hortalizas,Calabaza cacahuete cortada a trozos,Bandeja 450 g aprox.,1.8,,ud.,Mercadona,2024-03-11 00:00:00
Cebolla_y_ajo,Cebollas,Malla 1 kg,2.39,,ud.,Mercadona,2024-03-11 00:00:00
Cebolla_y_ajo,Cebollas,Malla 2 kg,3.85,,ud.,Mercadona,2024-03-11 00:00:00
Cebolla_y_ajo,Cebollas dulces,Malla 1 kg,2.44,,ud.,Mercadona,2024-03-11 00:00:00
Cebolla_y_ajo,Cebollas rojas,Malla 500 g,1.45,,ud.,Mercadona,2024-03-11 00:00:00
Cebolla_y_ajo,Cebollas tiernas,Manojo 3 ud.,1.29,,ud.,Mercadona,2024-03-11 00:00:00
Hierbas_aromaticas,Cebollino,Bandeja 20 g,1.8,,ud.,Mercadona,2024-03-11 00:00:00
Cereales_integrales_y_muesli,Cereales avena Crunchy Hacendado,Caja 400 g,2,1.9,ud.,Mercadona,2024-03-11 00:00:00
Cereales_integrales_y_muesli,Cereales avena Crunchy Hacendado de cacao,Caja 400 g,2.15,,ud.,Mercadona,2024-03-11 00:00:00
Cereales_integrales_y_muesli,Cereales Cereal Mix Hacendado 0% azúcares añadidos,Paquete 375 g,2.4,,ud.,Mercadona,2024-03-11 00:00:00
Cereales_integrales_y_muesli,Cereales con salvado de trigo Fibra Sticks Hacendado,Caja 500 g,1.8,,ud.,Mercadona,2024-03-11 00:00:00
Cereales,Cereales copos de maíz Corn Flakes Hacendado 0% azúcares añadidos,Caja 500 g,1.5,,ud.,Mercadona,2024-03-11 00:00:00
Cereales,Cereales copos de maíz Corn Flakes Harvest Home sin gluten,Caja 375 g,2.59,,ud.,Mercadona,2024-03-11 00:00:00
Cereales,Cereales copos de maíz Corn Flakes Kellogg's,Caja 500 g,3,,ud.,Mercadona,2024-03-11 00:00:00
Cereales,Cereales copos de trigo Chocodays Hacendado con chocolate,Caja 500 g,1.8,,ud.,Mercadona,2024-03-11 00:00:00
Cereales_integrales_y_muesli,Cereales copos de trigo espelta integral Hacendado 0% azúcares añadidos,Paquete 400 g,1.75,1.7,ud.,Mercadona,2024-03-11 00:00:00
Cereales_integrales_y_muesli,Cereales copos de trigo integral y arroz Hacendado 0% azúcares añadidos,Caja 500 g,2.05,2,ud.,Mercadona,2024-03-11 00:00:00
Cereales_integrales_y_muesli,Cereales copos de trigo integral y arroz Hacendado bañados en chocolate con leche,Caja 375 g,2.35,,ud.,Mercadona,2024-03-11 00:00:00
Cereales_integrales_y_muesli,Cereales copos de trigo integral y arroz Special K Classic,Caja 450 g,3.25,,ud.,Mercadona,2024-03-11 00:00:00
Cereales_integrales_y_muesli,Cereales copos tostados de trigo integral y arroz Hacendado con chocolate,Caja 425 g,2,,ud.,Mercadona,2024-03-11 00:00:00
Cereales,Cereales de arroz inflado Choco Krispies Kellogg's con chocolate,Caja 420 g,3.55,,ud.,Mercadona,2024-03-11 00:00:00
Cereales,Cereales de arroz inflado Choco Rice Hacendado con chocolate,Caja 500 g,2.1,,ud.,Mercadona,2024-03-11 00:00:00
Cereales,Cereales estrellas de maíz Stars Hacendado con miel,Caja 400 g,2.1,,ud.,Mercadona,2024-03-11 00:00:00
Cereales_integrales_y_muesli,Cereales integrales copos de trigo Chocapic Nestlé con chocolate,Caja 625 g,3.95,3.35,ud.,Mercadona,2024-03-11 00:00:00
Cereales,Cereales rellenos de chocolate y avellana Hacendado,Paquete 500 g,2.15,2.1,ud.,Mercadona,2024-03-11 00:00:00
Cereales,Cereales rellenos de crema de cacao y avellana Hacendado sin gluten,Paquete 400 g,2.25,,ud.,Mercadona,2024-03-11 00:00:00
Cereales,Cereales rellenos de leche Hacendado,Caja 500 g,2.6,2.5,ud.,Mercadona,2024-03-11 00:00:00
Cereales_integrales_y_muesli,Cereales y semillas granola Hacendado con frutos secos,Paquete 400 g,2.4,,ud.,Mercadona,2024-03-11 00:00:00
Setas_y_champinones,Champiñón grande,Bandeja 430 g aprox.,2.21,,ud.,Mercadona,2024-03-11 00:00:00
Setas_y_champinones,Champiñón laminado limpio,Bandeja 320 g aprox.,1.99,,ud.,Mercadona,2024-03-11 00:00:00
Setas_y_champinones,Champiñón pequeño,Bandeja 300 g aprox.,1.43,,ud.,Mercadona,2024-03-11 00:00:00
Setas_y_champinones,Champiñón Portobello,Bandeja 300 g aprox.,2.03,,ud.,Mercadona,2024-03-11 00:00:00
Hierbas_aromaticas,Cilantro,Bandeja 20 g,1.25,,ud.,Mercadona,2024-03-11 00:00:00
Huevos,Claras de huevo líquidas pasteurizadas,Botella 1 L,2.7,2.6,ud.,Mercadona,2024-03-11 00:00:00
Huevos,Claras de huevo líquidas pasteurizadas,Botella 300 ml,1.55,,ud.,Mercadona,2024-03-11 00:00:00
Repollo_y_col,Col lombarda,"Pieza 1,1 kg aprox.",2.03,,ud.,Mercadona,2024-03-11 00:00:00
Repollo_y_col,Coliflor,"Pieza 1,04 kg aprox.",2.06,,ud.,Mercadona,2024-03-11 00:00:00
Cereales_integrales_y_muesli,Copos crujientes de cereales Granola Hacendado con trozos de fresas,Paquete 400 g,2.4,,ud.,Mercadona,2024-03-11 00:00:00
Cereales_integrales_y_muesli,Copos de avena Brüggen,Caja 500 g,0.95,,ud.,Mercadona,2024-03-11 00:00:00
Arroz,Cous cous mediano Bia,Caja 1 kg,1.9,1.85,ud.,Mercadona,2024-03-11 00:00:00
Leche_condensada_y_otros,Crema de leche para café Campina,Paquete 20 ud. (200 ml),1.1,,ud.,Mercadona,2024-03-11 00:00:00
Vinagre_y_otros_aderezos,Crema de vinagre balsámico de Módena Hacendado,Botella 250 g,1.75,,ud.,Mercadona,2024-03-11 00:00:00
Edulcorantes_y_otros,Edulcorante en pastillas sacarina Hacendado,Bote 850 pastillas (52 g),1.15,,ud.,Mercadona,2024-03-11 00:00:00
Edulcorantes_y_otros,Edulcorante en pastillas stevia Hacendado,Bote 175 pastillas (9 g),1.85,,ud.,Mercadona,2024-03-11 00:00:00
Edulcorantes_y_otros,Edulcorante en sobres sacarina Hacendado,Caja 60 sobres (60 g),1.15,,ud.,Mercadona,2024-03-11 00:00:00
Edulcorantes_y_otros,Edulcorante en sobres stevia Hacendado,Caja 54 sobres (54 g),2,,ud.,Mercadona,2024-03-11 00:00:00
Edulcorantes_y_otros,Edulcorante Eritritol y Sucralosa Hacendado,Bote 200 g,3.2,,ud.,Mercadona,2024-03-11 00:00:00
Edulcorantes_y_otros,Edulcorante granulado stevia Hacendado,Bote 200 g,3.1,,ud.,Mercadona,2024-03-11 00:00:00
Edulcorantes_y_otros,Edulcorante líquido sacarina Hacendado,Bote 150 ml,0.85,,ud.,Mercadona,2024-03-11 00:00:00
Edulcorantes_y_otros,Edulcorante líquido stevia Hacendado,Bote 150 ml,2.05,,ud.,Mercadona,2024-03-11 00:00:00
Otras_verduras_y_hortalizas,Espárrago verde fino,Paquete 250 g,2.25,,ud.,Mercadona,2024-03-11 00:00:00
Otras_verduras_y_hortalizas,Espárrago verde grueso,Paquete 300 g,3.69,3.39,ud.,Mercadona,2024-03-11 00:00:00
Otras_verduras_y_hortalizas,Espinacas cortadas,Paquete 300 g,1.2,,ud.,Mercadona,2024-03-11 00:00:00
Fideos,Fideo al huevo Hacendado,Paquete 500 g,1.35,,ud.,Mercadona,2024-03-11 00:00:00
Fideos,Fideo cabello de ángel Hacendado,Paquete 500 g,0.82,,ud.,Mercadona,2024-03-11 00:00:00
Fideos,Fideo grueso Hacendado,Paquete 500 g,0.82,,ud.,Mercadona,2024-03-11 00:00:00
Fideos,Fideo mediano Hacendado,Paquete 500 g,0.82,,ud.,Mercadona,2024-03-11 00:00:00
Fideos_orientales,Fideos orientales sabor picante Hacendado,Vaso 65 g,1,,ud.,Mercadona,2024-03-11 00:00:00
Fideos_orientales,Fideos orientales sabor pollo Hacendado,Vaso 65 g,0.95,0.85,ud.,Mercadona,2024-03-11 00:00:00
Fideos_orientales,Fideos orientales Yakisoba classic Gallina Blanca,Vaso 93 g,1.95,,ud.,Mercadona,2024-03-11 00:00:00
Fideos_orientales,Fideos orientales Yakisoba sabor soja Hacendado,Paquete 90 g,0.9,,ud.,Mercadona,2024-03-11 00:00:00
Fideos_orientales,Fideos orientales Yakisoba sabor soja Hacendado,Vaso 80 g,1.3,,ud.,Mercadona,2024-03-11 00:00:00
